{
  "id": "njpw-20261016-fantastica-mania-2027",
  "title": "CMLL FANTASTICA MANIA 2027は仙台開幕、池田市が初開催になる",
  "publishedDate": "2026-10-16",
  "summary": "2027年2月のCMLL FANTASTICA MANIAは、2月17日の仙台から始まる。シリーズの途中には池田市での開催が初めて入り、最後は後楽園ホールの3連戦で締める。",
  "sourceUrl": "https://x.com/njpw1972/status/2111004221512290709",
  "sourceName": "新日本プロレス公式X",
  "relatedPromotionSlugs": [
    "njpw"
  ],
  "relatedWrestlerSlugs": [],
  "relatedEventIds": []
}
