{
  "id": "njpw-20261024-sjtl-kumagaya",
  "title": "SUPER Jr. TAG LEAGUEが熊谷で始まり、ワト組が先勝した",
  "publishedDate": "2026-10-24",
  "summary": "10月24日、熊谷市立市民体育館でSUPER Jr. TAG LEAGUE 2026の初戦があった。デスペラードの欠場で入った安田優虎はミスティコと組み、KUUKAI、マスター・ワトに敗れた。ワトは試合後に優勝すると述べた。ブレイク・クリスチャンとリー・ジョンソンは豹、YOHを下した。観衆は1112人。",
  "sourceUrl": "https://www.njpw.co.jp/tournament/result/662776",
  "sourceName": "新日本プロレス公式",
  "relatedPromotionSlugs": [
    "njpw"
  ],
  "relatedWrestlerSlugs": [
    "el-desperado",
    "masatora-yasuda",
    "mistico",
    "kuukai",
    "master-wato",
    "blake-christian",
    "lee-johnson",
    "hyo",
    "yoh"
  ],
  "relatedEventIds": [
    "njpw-20261024-0"
  ]
}
