{
  "id": "sample-phase-b-launch",
  "title": "pw.elni.net を公開しました（サンプル）",
  "publishedDate": "2026-08-16",
  "summary": "Phase B の骨組みとしてサイトを公開。掲載データは構造確認用のサンプルであり、実データへの差し替えは Phase C 以降に行う。",
  "sourceUrl": "https://pw.elni.net/",
  "sourceName": "pw.elni.net",
  "relatedPromotionSlugs": [],
  "relatedWrestlerSlugs": [],
  "relatedEventIds": []
}
