{
  "id": "ddt-20261021-utan-festa",
  "title": "11月8日の大森駅前でUTANフェスタ2026",
  "publishedDate": "2026-10-21",
  "summary": "DDTは11月8日、JR大森駅の東口前広場で『UTANフェスタ2026』を開く。平田一喜とイルシオンが第10代の世界大森級を争う。入場は無料。次の挑戦者を決めるバトルロイヤルのメンバーはまだ決まっていない。",
  "sourceUrl": "https://www.ddtpro.jp/news/6ad8789d9a5d3f0002f9d4c4",
  "sourceName": "DDTプロレスリング公式",
  "relatedPromotionSlugs": [
    "ddt"
  ],
  "relatedWrestlerSlugs": [
    "kazuki-hirata",
    "ilusion"
  ],
  "relatedEventIds": [
    "ddt-20261108-0"
  ]
}
