{
  "id": "njpw-20261013-super-jr-tag-league-teams",
  "title": "SUPER Jr. TAG LEAGUE 2026は12組で10月24日に開幕する",
  "publishedDate": "2026-10-13",
  "summary": "新日本はSUPER Jr. TAG LEAGUE 2026の参加12組を発表した。AブロックとBブロックが6組ずつ。開幕戦は10月24日の熊谷市立市民体育館で、優勝を決める試合は11月3日の広島サンプラザホールに置かれる。",
  "sourceUrl": "https://x.com/njpw1972/status/2109917061140947028",
  "sourceName": "新日本プロレス公式X",
  "relatedPromotionSlugs": [
    "njpw"
  ],
  "relatedWrestlerSlugs": [
    "kazuma-sumi",
    "ryusuke-taguchi",
    "kuukai",
    "master-wato",
    "robbie-x",
    "taiji-ishimori",
    "yoshinobu-kanemaru",
    "douki",
    "mistico",
    "el-desperado",
    "nick-wayne",
    "kushida",
    "daiki-nagai",
    "titan",
    "jacob-austin-young",
    "francesco-akira",
    "hyo",
    "yoh",
    "dick-togo",
    "sho",
    "kosei-fujita",
    "robbie-eagles",
    "lee-johnson",
    "blake-christian"
  ],
  "relatedEventIds": [
    "njpw-20261024-0",
    "njpw-20261103-0"
  ]
}
