{
  "id": "ajpw-20261022-hanawa-debut",
  "title": "練習生の塙元輝が大晦日の代々木でデビュー",
  "publishedDate": "2026-10-22",
  "summary": "4月に入門した塙元輝が、12月31日の国立代々木競技場第二体育館で鈴木秀樹とシングルを戦い、デビューする。",
  "sourceUrl": "https://www.all-japan.co.jp/news/news/14615/",
  "sourceName": "全日本プロレス公式サイト",
  "relatedPromotionSlugs": [
    "ajpw"
  ],
  "relatedWrestlerSlugs": [
    "genki-hanawa",
    "hideki-suzuki"
  ],
  "relatedEventIds": [
    "ajpw-20261231-0"
  ]
}
