{
  "id": "ddt-20261025-soka-mao",
  "title": "草加の駅前大会でMAOが葛西陽向からフォールを取った",
  "publishedDate": "2026-10-25",
  "summary": "10月25日、草加のアコスイベント広場で駅前大会のメインがあった。雨の中、MAOがキャノンボール450°で葛西陽向を下し、クリス・ブルックス、HARASHIMA組に勝った。MAOとクリス・ブルックスは11月3日の両国大会でKO-D無差別級の選手権を戦う。",
  "sourceUrl": "https://www.ddtpro.jp/results/6add76a65464e80002da4fe1",
  "sourceName": "DDTプロレスリング公式",
  "relatedPromotionSlugs": [
    "ddt"
  ],
  "relatedWrestlerSlugs": [
    "mao",
    "hinata-kasai",
    "chris-brookes",
    "harashima"
  ],
  "relatedEventIds": [
    "ddt-20261025-0",
    "ddt-20261103-0"
  ]
}
