{
  "id": "stardom-20261020-koguma-card-change",
  "title": "コグマ欠場で10月20日後楽園の2試合が入れ替わった",
  "publishedDate": "2026-10-20",
  "summary": "コグマが10月20日の後楽園大会を欠場し、2試合の顔ぶれが変わった。3WAYの一組は葉月、フワちゃん、月山和香になり、もう一方は8人タッグから6人タッグへ縮小された。",
  "sourceUrl": "https://x.com/wwr_stardom/status/2112383193227862203",
  "sourceName": "スターダム公式X",
  "relatedPromotionSlugs": [
    "stardom"
  ],
  "relatedWrestlerSlugs": [
    "koguma",
    "hazuki",
    "fuwa-chan",
    "waka-tsukiyama",
    "natsuko-tora"
  ],
  "relatedEventIds": [
    "stardom-20261020-0"
  ]
}
