{
  "id": "njpw-20261013-hiroshima-cards",
  "title": "11月3日広島の主要カードが固まった",
  "publishedDate": "2026-10-13",
  "summary": "POWER STRUGGLEの中心カードが発表された。ボルチン・オレッグ、辻陽太、ケニー・オメガの3WAY、IWGP GLOBALのタイチ対ゲイブ・キッド、IWGPタッグのK.O.B対ウィル・オスプレイとカラム・ニューマン、鷹木信悟とジェフ・コブ対ジョン・モクスリーとウィーラー・ユウタが組まれる。",
  "sourceUrl": "https://x.com/njpw1972/status/2109918310649278863",
  "sourceName": "新日本プロレス公式X",
  "relatedPromotionSlugs": [
    "njpw"
  ],
  "relatedWrestlerSlugs": [
    "boltin-oleg",
    "yota-tsuji",
    "kenny-omega",
    "taichi",
    "gabe-kidd",
    "oskar",
    "yuto-ice",
    "will-ospreay",
    "callum-newman",
    "shingo-takagi",
    "jeff-cobb",
    "jon-moxley",
    "wheeler-yuta"
  ],
  "relatedEventIds": [
    "njpw-20261103-0"
  ]
}
