{
  "id": "ddt-20261024-ryogoku-3way",
  "title": "両国のディーノ対佐々木はTAKESHITA入りの3WAYに変わった",
  "publishedDate": "2026-10-24",
  "summary": "10月24日、KONOSUKE TAKESHITAが11月3日の両国国技館大会に加わることが発表された。男色ディーノと佐々木大輔のシングルは、TAKESHITAを含めた3人の試合に組み替えられた。",
  "sourceUrl": "https://www.ddtpro.jp/news/6adcaff2063b8e0002a18771",
  "sourceName": "DDTプロレスリング公式",
  "relatedPromotionSlugs": [
    "ddt"
  ],
  "relatedWrestlerSlugs": [
    "konosuke-takeshita",
    "danshoku-dieno",
    "daisuke-sasaki"
  ],
  "relatedEventIds": [
    "ddt-20261103-0"
  ]
}
