{
  "id": "ajpw-20261011-asia-tag-musashi-yoshioka",
  "title": "MUSASHIと吉岡世起がアジアタッグ王座を獲得",
  "publishedDate": "2026-10-11",
  "summary": "仙台大会の王座決定戦で田村男児と立花誠吾を下し、第133代王者になった。このタッグでは通算3度目の戴冠になる。",
  "sourceUrl": "https://www.all-japan.co.jp/match/12223/",
  "sourceName": "全日本プロレス公式サイト",
  "relatedPromotionSlugs": [
    "ajpw"
  ],
  "relatedWrestlerSlugs": [
    "musashi",
    "seiki-yoshioka",
    "dan-tamura",
    "seigo-tachibana"
  ],
  "relatedEventIds": [
    "ajpw-20261011-0"
  ]
}
