{
  "id": "ddt-20261018-taguchi-retains-universal",
  "title": "田口隆祐がDDT UNIVERSAL王座を2日続けて守った",
  "publishedDate": "2026-10-18",
  "summary": "田口隆祐は10月17日、新日本の石狩大会でディック東郷を下し、翌18日のDDT後楽園では彰人を下した。DDT UNIVERSAL王座の防衛が2日連続になった。次の挑戦者は11月29日後楽園のTo-y。",
  "sourceUrl": "https://x.com/ddtpro/status/2111741845139247332",
  "sourceName": "DDT公式X",
  "relatedPromotionSlugs": [
    "ddt",
    "njpw"
  ],
  "relatedWrestlerSlugs": [
    "ryusuke-taguchi",
    "akito",
    "to-y",
    "dick-togo"
  ],
  "relatedEventIds": [
    "ddt-20261018-0",
    "njpw-20261017-0",
    "ddt-20261129-0"
  ]
}
