{
  "id": "ajpw-20261023-yoyogi-cards",
  "title": "大晦日の代々木大会に三冠戦と安齊勇馬対菊田円が追加",
  "publishedDate": "2026-10-23",
  "summary": "12月31日の代々木大会に、宮原健斗対青柳優馬の三冠ヘビー級選手権と、安齊勇馬対菊田円のシングルが加わった。",
  "sourceUrl": "https://www.all-japan.co.jp/news/news/14680/",
  "sourceName": "全日本プロレス公式サイト",
  "relatedPromotionSlugs": [
    "ajpw"
  ],
  "relatedWrestlerSlugs": [
    "kento-miyahara",
    "yuma-aoyagi",
    "yuma-anzai",
    "madoka-kikuta"
  ],
  "relatedEventIds": [
    "ajpw-20261231-0"
  ]
}
