{
  "id": "stardom-20261011-mizumori-retains-high-speed",
  "title": "後楽園で水森由菜がハイスピード王座を6度守った",
  "publishedDate": "2026-10-11",
  "summary": "10月11日の後楽園ホールで、ハイスピード王者の水森由菜がなつぽいを下した。水森の防衛回数は6度目になる。",
  "sourceUrl": "https://wwr-stardom.com/event/20261011_korakuen/",
  "sourceName": "スターダム公式",
  "relatedPromotionSlugs": [
    "stardom"
  ],
  "relatedWrestlerSlugs": [
    "yuna-mizumori",
    "natsupoi"
  ],
  "relatedEventIds": [
    "stardom-20261011-0"
  ]
}
