{
  "id": "stardom-20261018-goddess-tag-league-schedule",
  "title": "第16回ゴッデス・オブ・スターダムは11月1日開幕、11月29日に決勝",
  "publishedDate": "2026-10-18",
  "summary": "スターダムの第16回ゴッデス・オブ・スターダム・タッグリーグは、11月1日の後楽園ホールで始まり、11月29日の浜松で優勝を決める。途中には沼津、高崎、松山、高知、秋田、福島、郡山、岡崎がはさまる。",
  "sourceUrl": "https://x.com/wwr_stardom/status/2111781841967444377",
  "sourceName": "スターダム公式X",
  "relatedPromotionSlugs": [
    "stardom"
  ],
  "relatedWrestlerSlugs": [],
  "relatedEventIds": [
    "stardom-20261101-0",
    "stardom-20261129-0"
  ]
}
