{
  "id": "stardom-20261025-korakuen-card-split",
  "title": "AZMと天咲光由の欠場で10月27日後楽園が8試合になった",
  "publishedDate": "2026-10-25",
  "summary": "AZMと天咲光由が10月27日の後楽園大会を欠場する。3組で組まれていた試合は、舞華対レディ・C対儛島エマの3WAYと、HANAKO、浜辺纏対妃南、虎龍清花のタッグに分かれた。試合数は8になった。",
  "sourceUrl": "https://wwr-stardom.com/news/261025news/",
  "sourceName": "スターダム公式",
  "relatedPromotionSlugs": [
    "stardom"
  ],
  "relatedWrestlerSlugs": [
    "azm",
    "miyu-amasaki",
    "maika",
    "lady-c",
    "ema-maishima",
    "hanako",
    "matoi-hamabe",
    "hina",
    "kiyoka-kotatsu"
  ],
  "relatedEventIds": [
    "stardom-20261027-0"
  ]
}
