{
  "id": "njpw-20261021-tanahashi-jam-2-card",
  "title": "11月19日TANAHASHI JAM 2の主な対戦が決まった",
  "publishedDate": "2026-10-21",
  "summary": "11月19日後楽園の『TANAHASHI JAM 2』で主な対戦が決まった。シュン・スカイウォーカーのNJPW WORLD認定TV王座に矢野通が挑む。藤波辰爾を含む8人タッグがHOUSE OF TORTUREと当たり、台湾のアックス・ワンは海野翔太戦で新日本に初登場する。DDTから正田壮史と武知海青も入る。モンスターランボーの出場者は当日まで出ない。",
  "sourceUrl": "https://www.njpw.co.jp/677061",
  "sourceName": "新日本プロレス公式",
  "relatedPromotionSlugs": [
    "njpw",
    "ddt"
  ],
  "relatedWrestlerSlugs": [
    "shun-skywalker",
    "toru-yano",
    "tatsumi-fujinami",
    "axe-wang",
    "shota-umino",
    "takeshi-masada",
    "kaisei-takechi",
    "kaito-kiyomiya"
  ],
  "relatedEventIds": [
    "njpw-20261119-0"
  ]
}
