{
  "id": "ddt-20261021-january-2027-tickets",
  "title": "DDTが2027年1月4大会のチケット先行を案内",
  "publishedDate": "2026-10-21",
  "summary": "DDTは2027年1月の4大会について、チケットの先行受付を案内した。1月3日は後楽園ホール、1月5日は横浜ラジアントホール、1月9日と10日は大阪のアゼリア大正。対戦はまだ発表されていない。",
  "sourceUrl": "https://x.com/ddtpro/status/2112801059643261087",
  "sourceName": "DDT公式X",
  "relatedPromotionSlugs": [
    "ddt"
  ],
  "relatedWrestlerSlugs": [],
  "relatedEventIds": [
    "ddt-20270103-0",
    "ddt-20270105-0",
    "ddt-20270109-0",
    "ddt-20270110-0"
  ]
}
