{
  "id": "stardom-20261021-korakuen-ota-cards",
  "title": "10月27日後楽園と10月29日大田区の全カードが揃った",
  "publishedDate": "2026-10-21",
  "summary": "10月27日の後楽園と10月29日の大田区総合体育館で、残っていた対戦が出そろった。大田区にはSTARS対H.A.T.E.の8対8、なつぽいと鷹木信悟対水森由菜と後藤洋央紀、鈴季すず対スターライト・キッドのワールド王座戦がある。後楽園では八神蘭奈のフューチャー王座に稲葉あずさが挑む。鈴季すずの相方はまだ空欄。",
  "sourceUrl": "https://x.com/wwr_stardom/status/2112868915839902172",
  "sourceName": "スターダム公式X",
  "relatedPromotionSlugs": [
    "stardom",
    "njpw"
  ],
  "relatedWrestlerSlugs": [
    "ranna-yagami",
    "azusa-inaba",
    "suzu-suzuki",
    "starlight-kid",
    "natsupoi",
    "shingo-takagi",
    "yuna-mizumori",
    "hirooki-goto"
  ],
  "relatedEventIds": [
    "stardom-20261027-0",
    "stardom-20261029-0"
  ]
}
