{
  "id": "ddt-20261026-nagareyama-lucha",
  "title": "流山おおたかの森で10月31日に無料の屋外ルチャ",
  "publishedDate": "2026-10-26",
  "summary": "10月31日、流山市おおたかの森の森のまち広場で屋外のルチャリブレが入場無料で開かれる。試合は3つ決まり、土地の名前を付けた覆面選手が初めて登場する。望月成晃やポイズン澤田JULIE、JTOと東京女子の選手も出る。DDTが監修する催しだが、DDTの所属選手はカードに入っていない。",
  "sourceUrl": "https://www.ddtpro.jp/news/6adf025dd6cd800002a30b90",
  "sourceName": "DDTプロレスリング公式",
  "relatedPromotionSlugs": [
    "ddt"
  ],
  "relatedWrestlerSlugs": [
    "noda-shoyuman",
    "jewel-bird",
    "rappy-yoshikawa",
    "princess-misato",
    "sakura-hattori",
    "ren-konatsu",
    "masaaki-mochizuki",
    "toru-owashi",
    "el-nagare",
    "poison-sawada-julie",
    "kashiwa-hardcore",
    "matsudo-inferno"
  ],
  "relatedEventIds": [
    "ddt-20261031-0"
  ]
}
