{
  "id": "njpw-20261012-tanahashi-jam-2",
  "title": "11月19日後楽園でTANAHASHI JAM 2が開かれる",
  "publishedDate": "2026-10-12",
  "summary": "棚橋弘至社長は、11月19日の後楽園ホールで『TANAHASHI JAM 2』を開くと、10月12日の両国大会の場で明らかにした。CSテレ朝チャンネルの番組に連なる興行で、対戦カードはこれから発表される。",
  "sourceUrl": "https://www.njpw.co.jp/tournament/result/662775",
  "sourceName": "新日本プロレス公式",
  "relatedPromotionSlugs": [
    "njpw"
  ],
  "relatedWrestlerSlugs": [],
  "relatedEventIds": [
    "njpw-20261119-0"
  ]
}
